33417831;Men In The City;Five men attend the same gym in Berlin. None of them seem to have anything in common, but all five have not enough confidence to meet or develop relationships with the opposite sex, and what it really means to be a man or what women expect of them. Günther Stobanski, portrayed by Christian Ulmen, fails with Internet dating, music producer Jerome Ades, portrayed by Til Schweiger, passes from a sentimental break-up story to another. Roland Feldberg, a train driver portrayed by Wotan Wilke Möhring, snubs his wife Susanne Feldberg portrayed by Nadja Uhl. The girlfriend of Philip Henrion, portrayed by Maxim Mehmet, becomes pregnant at a young age. Niklas Michalke, a solicitor portrayed by Florian David Fitz, is terrified by his impending marriage, while Bruce Berger, a singer portrayed by Justus von Dohnányi, tries to pursue his singing career.
2408359;Bikini Beach;"School is out and the teenagers head for the beach. All is well until millionaire Harvey Huntington Honeywagon III  comes around, convinced that the beachgoers are so senselessly obsessed with sex that their mentality is below that of a primate – especially Honeywagon's wunderkind pet chimp Clyde, who can surf, drive, and watusi better than anyone on the beach. With the teenagers demoralized and discredited, Honeywagon plans to turn Bikini Beach into a senior citizens retirement home. Meanwhile, foppish British rocker and drag racer Peter Royce Bentley, better known as ""The Potato Bug"" , has taken up residence on Bikini Beach. Annoyed by Frankie's reluctance to start their relationship towards marriage, Dee Dee becomes receptive to Potato Bug's advances. In a jealous rage, Frankie challenges The Potato Bug to a drag race, in hopes of winning Dee Dee back."
1838882;The Storm Riders;The evil Lord Conqueror, head of Conqueror's Clan, is given a prophecy by Mud Buddha. It is said that if Conqueror finds two young children by the name of Wind and Cloud he will have good fortune. Mud Buddha tells Conqueror to look for him 10 years later so that he can tell the rest of Conqueror's fortune. Conqueror issues an order that every boy with a birth chart matching Wind's or Cloud's must become a disciple of the Conqueror's Clan. Both Wind and Cloud are found, and Lord Conqueror's servants murder their respective parents. Ten years pass, and Wind and Cloud are now both fully grown and highly skilled martial artists. Lord Conqueror raised them as his own children. He is angered by the disappearance of Mud Buddha and sends his men to find him. After Mud Buddha is found, he reveals that Wind and Cloud will either join or destroy Conqueror. Seeing that Wind and Cloud can lead to misfortune, Conqueror uses his daughter, Charity, to cause Wind and Cloud to fight each other. There was a love triangle involving Wind, Cloud, and Charity. Conqueror arranges a marriage with Wind and Charity. Cloud finds out and is unhappy about it. On the day of the wedding, he takes her away and Conqueror tells Wind to fight for his wife. Wind and Cloud engage in a battle and Lord Conqueror tries to kill Cloud in their duel, but killed his own daughter. This was because she tried to protect Cloud. Cloud and Wind's relationship with Lord Conqueror sours, after Cloud loses an arm to Conqueror in combat and Wind is poisoned by Conqueror's minions. Wind finds out the truth about who killed his parents and fights a fire beast which killed his father. Fortunately, Cloud is found by helpful villagers, one of whom donates his arm to replace Cloud's loss. Wind and Cloud then work together to destroy Lord Conqueror. Together, they defeat the evil warlord, finally exacting their revenge and fulfilling Mud Buddha's prophecy.
25755313;Against Her Will: An Incident in Baltimore;The sequel to the TV movie entitled The Incident, a small-town lawyer, Harmon Cobb, and his family move to Baltimore where he becomes the law partner of his old adversary, where he goes against the State of Maryland, suing on behalf of an institutionalized mental patient for release.http://www.tcm.com/tcmdb/title.jsp?stid=456508
10016997;Milk and Honey;A farmer is busy with hoeing while his son Porky is ploughing the fields with his horse Dobbin. Hank Horsefly speeds up the process. The farmer and Porky are about to take a turn for the worst as Mr. Viper The Snake comes with a Mortgage form ready to evict them unless a sum of rent money is paid. Porky applies for a job as horse driving milkman with a strict condition not to break a single bottle. Porky is doing well until Hank having followed their trail, sends Dobbin going at full speed and crashing, causing all the milk bottles to break. As Porky despairs, Dobbin accidentally enters a horse race. When the race starts, Dobbin isn't getting far, until Hank kick starts Dobbin to overtake every racer and wins a $40,000 prize. Porky makes it to the farm in the nick of time, riding in a roofless limo. Porky pays the owed money to Mr. Viper and Hank gives him a kick.
8153846;La Cité de la peur;Odile Deray  is the publicist for the slasher movie Red is Dead, which features a serial killer whose weapons of choice are the hammer and sickle. She is invited to the Cannes film festival, where she is faced with the unanimous opinion that the movie is extremely bad. However, Red is Dead soon attracts the public attention when its projectionist is murdered by what seems to be a copycat of the movie's killer. Ecstatic, Odile brings the movie's mentally retarded star Simon Jérémi  to the festival and hires bodyguard and self-proclaimed womanizer Serge Karamazov  to protect them. One by one, all the projectionists assigned to the movie are murdered, keeping Red is Dead in the spotlight. Meanwhile, detective Patrick Bialès  investigates on the murders and starts a romantic relationship with Odile.
24486071;Cheap Kisses;The plot focuses on a famous sculptor, Gustaf Borgstrom . He hires a chorus girl, Ardell Kendall . When Donald Dillingham  marries the chorus girl, his wealthy parents disown him.
4466226;The Saddest Music in the World;"During the Great depression in 1933 in Winnipeg, Canada, an old fortune teller is predicting the future for Chester Kent , a failing Broadway producer, and his nymphomaniac amnesiac girlfriend Narcissa . The fortune teller predicts doom, but Chester laughs it off, and rides a train into Winnipeg. The baroness Helen, Lady Port-Huntley  announces a competition to find the saddest music in the world; she hopes that the competition will raise the sales of her beer, especially since Prohibition is about to end. Chester decides to enter the contest representing America. It emerges that Lady Port-Huntley, who has no legs, was once Chester's lover; and saying that ""of all the people in the world, you know the least about grief"", she orders him to try to make her cry by retelling how she lost her legs. It emerges that his dad Fyodor Kent  was also in love with her. After she left him, Fyodor became an alcoholic. One day as they were driving as Helen performs oral sex on Chester, they crashed into Fyodor's car, and Helen's left leg was trapped in the wreckage. A drunken Fyodor, determined to save and marry his beloved, amputated her leg but removed the wrong one accidentally. In the present, Lady Port-Huntley tells Chester he can try, but she doesn't think he'll succeed. Fyodor also shows up and enters the contest to represent Canada. Musicians are streaming into Winnipeg, including Roderick Kent , representing Serbia. Roderick is swathed in mourning and hypochondria, because his young son died and his wife is missing. As soon as he arrives, he and Chester begin grating on each other. A sober Fyodor also reveals that he has been making prosthetic legs for Helen to atone for his tragic mistake. She's allergic to wood and leather, so he uses glass ones, and fills them with her brand of beer. The contest begins, with various countries pitted against each other. Fyodor's melodramatic piano ballad is soon defeated, but Chester's glitzy ""Swing Low, Sweet Chariot"" act wins over the audience. Unfortunately Roderick sees Narcissa singing from a swinging seat, and collapses in horror realizing it's his wife singing. Roderick manages to do his act, and defeats everyone with his heartbreaking cello music. After, Roderick gives his father's glass legs to Lady Port-Huntley, who is able to walk for the first time in years. Overjoyed, she reunites with Chester, but when Fyodor begs her for forgiveness, she refuses to give it. Shattered, Fyodor returns to drinking, falls through the glass ceiling of the contest arena into a pool of beer, and dies. Meanwhile, Roderick has reunited with his wife; since Narcissa doesn't remember him or their son, however, she simply regards him as a one-night stand, and sings a tragic love song as if it were a showtune. Roderick accidentally drops a jar containing his dead son's heart, and it shatters. Roderick becomes determined to defeat his brother, and plays his most plaintive music ever, while Chester manipulates the audience with his showtunes, often buying out other countries he's defeated in the contest to ""join America"" in his performance. Soon the brothers are the only ones left in the competition, and Lady Port-Huntley &mdash; with her glass legs &mdash; is part of Chester's final act. But a few jagged notes from Roderick's cello are enough to spring leaks in the glass, and the legs collapse. Horrified and humiliated, she orders her gigolo to carry her back to her office. Roderick plays his most tragic piece, and Narcissa sings sadly to it as her memories return. Chester goes to comfort Helen, but she stabs him with a giant piece of glass from her shattered legs. The bleeding Chester staggers out smoking a cigar, dropping a match in a puddle of spilled beer. Soon the entire building goes up in flames. Teddy rescues Helen, and Roderick and Narcissa escape. Chester staggers to a piano and plays Narcissa's ballad &mdash; the saddest music in the world &mdash; as he burns in the fire."
27975390;A Slumdog Millionaire Goes Dancing;Reportedly, the film is about slum kids who are trained for a dance competition.Shaimak Davar in a director's avatar
6167400;Twist;The film is similar in some ways to Seth Michael Donsky's 1996 film Twisted made prior to Tierney's film. Like in Donsky's film, the plot of Oliver Twist is updated to the present day, and moved out of the London poor house onto the streets of Toronto. In addition, the tale is told not from Oliver's point of view, but rather that of Dodge . The prosaically beautiful Oliver  falls into the hands of down-and-out young men. Dodge takes Oliver under his wing and instructs him in the unforgiving arts of drug abuse and prostitution. Oliver develops a crush on Dodge and views him as his boyfriend, complicating their friendship. Dodge does not reciprocate his feelings, and reacts angrily to Oliver's kisses and other signs of affection. As Oliver's innocence dissolves, both young men confront their demons and ultimately it is Dodge who finds he cannot escape his past. Dodge is found by his abusive brother around the same time the young mens care taker commits suicide, sending Dodge into a violent rage at the films conclusion.
17711304;Rendezvous;"In 1917, former newspaperman William Gordon  enlists in the U.S. Army. The day before he is to leave Washington, D.C. for the fighting in Europe, he meets socialite Joel Carter . The couple spend the day together. He tells her that, because he once wrote a book on cryptography under a pen name, the army is searching for him to put him to work behind a desk, but he is eager to fight the Germans. The next day, just before he boards his train, Lieutenant Gordon is ordered to report to John Carter , the Assistant Secretary of War. He reassigns the unhappy Gordon to Major William Brennan  to spend the war decoding German transmissions. He learns that Joel had revealed his secret to her uncle, John Carter, in order to keep him around. The U.S. is preparing to send its army across the Atlantic Ocean, but there are grave worries about the U-boat threat. Brennan comes up with the idea to have British escorts meet American transports before they enter the most dangerous zone. For maximum security, the rendezvous point is to be transmitted in code to the ships the day before. An ammunition ship is sent first to test the new system. Unbeknownst to the Americans, a German spy ring in the city has already cracked their code and deliberately allowed the ship through in order to lure more valuable troop transports into their trap. However, when Gordon manages to decipher one of their messages, he realizes the truth and alerts his superiors. Brennan suspects his supposedly unbreakable code was stolen by his mistress, Olivia Karloff , and sets a trap. He catches her red-handed, but foolishly he is alone, and she shoots him dead. To her dismay, she is ordered to sacrifice herself to divert suspicion from the spy ring. When she attends Brennan's funeral, Gordon has her brought in for questioning. Carter sees her enter Gordon's office and becomes very jealous. Gordon lets Karloff go free so that she might lead him to the rest of the spies. The Germans decide to betray one of their own men, Captain Nicholas Nieterstein , in order to reassure the Americans and get them to resume operations. When he is arrested at the Russian Embassy, Nieterstein apologizes to Ambassador Gregory  for giving his loyalty to his mother's country before flinging himself through a window to his death. Afterward, Gordon escorts a shaken Karloff back to her hotel, where he discovers her guilt. However, since the hotel is staffed by German agents, he is the one who is captured. He refuses to divulge the new American code until they show him that Carter is also a prisoner; she had followed the pair to the hotel. He then gives in and provides the coordinates of the new rendezvous point. When the Germans transmit the information, it is decoded by the Americans. The latitude and longitude that Gordon had given are actually the address of the hotel. Gordon and Carter  are rescued. They get married."
18392317;Mysterious Mose;"Betty is startled awake in her bed on a stormy night. She searches for the cause of the shock while she sings the song. Then, unexplainable phenomena start happening in the house. Mysterious Mose  appears, and sings part of the song. Bizarre cartoon creatures appear and, at first, sing and enhance Mose's ""mysterious"" image. Quickly, however, the antics become frightful even to Mose. The film escalates into chaos, which ends when Mose bursts, revealing him having been a construction  the whole time. Graveyard Jamboree with Mysterious Mose is a short film made in 1998 by film makers Seamus Walsh and Mark Caballero of Screen Novelties. The film utilizes puppetry, stop motion and silhouette animation to tell the story of an otherworldly creature preparing a celebration in a cemetery. Walsh and Caballero used the song Mysterious Mose recorded in 1930 by Harry Reser and his Radio All-star Novelty Orchestra. The film has gained world wide attention in film festivals and has retained a small cult audience."
15161056;Killjoy;"{{plot}} The film begins with a boy named Michael , a kid who has the hots for a beautiful girl named Jada , but is always rejected because Jada is stuck with a gangster, Lorenzo , and when Michael comes close to her, he is threatened with bodily harm by getting beat up by both Lorenzo and his homeboys, T-Bone  and Baby Boy . But Michael is secretly involved in black magic, and tries to bring a doll that he keeps calling Killjoy to life. But the spell does not work quickly; after he is abducted by the gangsters and brought into an abandoned area of the woods, Michael is accidentally shot and killed by Lorenzo when they were supposedly joking around with him. A year later, Jada is now going out with a guy named Jamal , who is just as nice as Michael was. Meanwhile, Lorenzo is now going out with a girl named Kahara , who is just like Jada. When Lorenzo leaves to have sex with her, T-Bone and Baby Boy go to get some ice-cream to get munchies, when the ice-cream man, who's dressed up like a clown  really sells drugs. Baby Boy and T-Bone hop in the truck, when suddenly, they end up in some abandoned building, far away from where they live. They split up to find a way out. Baby Boy finds a way out, but before he can make a run for it, he gets rammed into the wall by the ice-cream truck. Meanwhile, T-Bone finds some pot lying on the ground and starts to smoke it, when suddenly, the pot starts to burn him, and his body vanishes, and ends up back to his hide-out, along with Baby Boy. Meanwhile, Lorenzo, after having sex with Kahara, hears something outside her apartment building, and goes outside to check. He finds the ice-cream truck and opens the door, and the ice-cream man pulls him in, and ends up at the abandoned building. After finding the ice-cream man, he confronts him and shows him the  corpses of T-Bone and Baby Boy; after they fade away, he shoots the ice-cream man dozens of times, but the ice-cream man sucks up the bullets (a spoof of [[The Mask  and shoots the bullets out of his mouth, killing Lorenzo. Meanwhile, one of Jada's friends, Monique , calls Jada, telling her that some guy  came in to her room and needs them to come over. The homeless man tells them that Lorenzo killed Michael a year ago, and explains that Michael was brought back to life by the Ice Cream Man, whose real name's Killjoy, the doll Michael has, and tells them that Killjoy just killed Lorenzo, Baby Boy, and T-Bone. Then he tells them that Killjoy/Michael can be killed by Jada, because the love of a young woman can destroy the evil in the heart. Before leaving, he tells them that they have to kill the doll the spirit of the ice cream man came from, and the ice cream truck is outside. Still not believing what the homeless man said, they go inside the ice-cream truck to check it out, and they end up in the abandoned building, where they're confronted by T-Bone, Baby Boy, and Lorenzo, who souls' are under Killjoy's control and are now his accomplices. The trio start fighting the accomplices until all three are killed. Then Killjoy comes out and knocks Jamal and Monique out. He asks Jada for a kiss, upon which Jada agrees to do so, under one condition: that he will leave her world and never come back. But instead of disappearing, Killjoy transforms into Michael. Michael tells Jada that he did it all for her. Jada, who desperately wants to stop Michael/Killjoy from killing, stabs Michael to death, and Michael fades away. Jamal, Jada, and Monique are about to leave when Killjoy, Lorenzo, T-Bone, and Baby Boy appear behind them. Jada then remembers from the Homeless man that they have to kill the doll. The trio frantically run back into the ice-cream truck, where they end up in Michael's house, where the doll lies on the floor. The doll turns into Michael, who constantly begs her for forgiveness, but Jada continues to stab it. The earth starts to shake, and while Jada, Jamal, and Monique try to stay still within the circle of candles without breaking it, Baby Boy, T-Bone, and Lorenzo's souls are sucked into a portal. The trio then watch as Killjoy finishes off Michael , and the trio are sent back to Jada's room, where the homeless man thanks them, and vanishes, meaning he's an angel from heaven. The trio decides to go out and eat, when they are confronted by Ray Jackson , and Tamara , who are both in Jada's English class. Ray says that he gained access into the club free because his brother owns the place, and his name is......Killjoy! The trio then see that Ray turns into Killjoy, and Tamara turns into Lorenzo. Killjoy starts laughing maniacally at the trio, with Jada screaming ""NO!"", until Jada wakes up in bed, along with Jamal, indicating that the entire experience was all a dream. Jamal tries to calm Jada down by going under the covers to perform oral sex on her, but then rises from the covers as Killjoy. The film ends with a shot of Jada screaming and Killjoy stating, ""That was some good pussay!!!"", followed by evil laughter."
21500407;You;"{{Plot}} Husband and wife Rawdon  and Miranda  are soulmates. Their love for each other is palpable as they lie in bed treasuring their 6 month old daughter Quincey. Miranda fantasizes about the speech she plans to make when, one day in their future, she will give this tiny infant away at her wedding. Tragically, when Quincey is 3, Miranda is killed in a car accident and Rawdon is left alone, unmoored, to continue life without the love of his life. Fortunately Rawdon still has Quincey. Staying as strong as he can he takes her to the roof of a skyscraper and explains that Mommy is now an angel. It is up here that for the first time they see a vision of Miranda as an angel. Rawdon continues to see visions of her. Initially these visions help him—at home she gives him advice about parenting; in Portugal she softens his hardness; when he hides in the closet to isolate himself she snaps some sense into him and insists that Rawdon keep her mother, father and brother—Quincey's Grandparents  and Uncle Jack  – firmly in Quincey's life. Rawdon explains these visions to his therapist Paula  as she helps him with the long grieving process and over a period of years, with Quincey growing before our eyes, Rawdon tries to move on with his life. He tries to date other women. Disastrously. He falls instantly in love with Sam  who ends up becoming his good friend and a surrogate Aunt to Quincey. He dates other including Kimberly  who Quincey wisely suggests is far better suited to her Uncle Jack. And she is right. When Jack and Kimberly get married, Rawdon is their best man. All the while Miranda's metaphysical presence is with him. He goes from needing her, to blaming her, being angry at her. But for a long, long time he won't let her go away. Part of him wants her to stay alive in his imagination forever and gradually this presence that helped him initially eventually becomes an impediment to his moving on in life. In contrast to her Dad's stagnation, Quincey is growing up fast , and in no time she is dating, stealing cars, trying to set her Dad up with her best friend's divorced Moms, going off to University and falling in love with a Frenchman named Philippe. It is not until Rawdon finally plucks up the courage to ask out somebody who might just be right for him that he finally, tearfully, asks Miranda to leave him. This is ultimately a coming of age story. We watch Quincey literally come of age whilst her father, emotionally, comes of age. He eventually gives up the now stultifying memory of his dead wife and arrives at a new beginning. The end of this story is also the beginning of another where Rawdon, surrounded by the people he loves—but without Miranda—finds himself giving Quincey away at her wedding to Philippe. And here he makes the speech that Miranda made in bed with him and Quincey so many years before."
3459677;Shaadi No. 1;Raj Mittal , Veer Saxena  and Aryan Kapoor  are unhappy with their respective marriages even though they love their spouses. Their wives Bhavana , Diya  and Sonia  are busy with their everyday lives, and their husbands feel ignored by them. Bhavana constantly uses religion as an excuse to not be intimate with her husband, Diya aspires to be an actress, and Sonia is a lawyer who is obsessed with her cases. Soon the three men come across three beauties: Madhuri , Rekha  and Dimple . It is not long before they are tempted by them. Unfortunately for them Lucky Bhai  is out to make hell and expose them to their unassuming wives.
34420857;Kelviyum Naane Pathilum Naane;Nirmal ([[Karthik  teaches piano to Usha . Nirmal meets Janaki  many times and they fall in love with each other. When his student Usha tells him her love, Nirmal says that he is love with Janaki and they will get married soon. Melancholic, she commits suicide. Later, many people cross Nirmal's path thinking it's Babu. At the marriage ceremony, Satyavati  tries to stop thinking it's her son Babu and they all explain it's Nirmal. Few days after the marriage, Nirmal meets an accident and his car burns, the police officers concludes that he's dead. In actuality, Satyavati was Usha's mother, created the character of Babu and she escrows Nirmal. When Nirmal says the truth to Janaki, she thinks that it's Babu. Janaki's father tells to Satyavati that Janaki is her daughter. Satyavati forgives Nirmal, but he decides to revenge her and Usha, he goes to jail for Nirmal's murder as Babu. Satyavati appoints Rajagopal , a lawyer, to save him. Finally, Nirmal is liberated and Satyavati dies to rejoin her late daughter Usha.
