4803289;Until Death;"New Orleans narcotics detective Anthony Stowe  is a heroin addict who is teetering on the edge of oblivion, and he could not care less. At the moment, he is trying to bring down his former partner Gabriel Callahan , who has become a drug kingpin. Callahan is trying to, and slowly succeeding at, taking over the New Orleans underworld. Stowe botches a sting operation against Callahan, resulting in the death of fellow cop Maria Ronson , whose fiancee, fellow cop Van Huffel , nearly comes to blows with him over it. Chief Mac Baylor  has a very blunt chat with Stowe, who is dismissive. Stowe is approached by fellow cop Walter Curry  to help his nephew beat a drug-dealing charge; he instead turns Curry over to Baylor, who fires him. After barricading himself in the station bathroom, Walter confronts an unrepentant Stowe and condemns him for betraying his fellow officers. That night Stowe meets with his estranged wife Valerie , who tells him that she's pregnant, but that he's not the father. Valerie, whose marriage with Stowe is close to collapse, has been seeing a man named Mark Rossini , the gym teacher at the school she is principal of. But he may not be the father either. Stowe brashly accuses Valerie of being impregnated by Callahan, and she tells him she never wants to see him again. The only thing keeping Stowe from total collapse is his dogged pursuit of Callahan. But he drunkenly stumbles into an ambush masterminded by Callahan, and is shot in the head by Callahan's right-hand man Jimmy . Stowe undergoes emergency surgery, and ends up in a coma. Months later, he recovers to the point that he opens his eyes, and is transported to his and Valerie's house to recover properly. Seven months later, Stowe is slowly learning to walk and speak again. He manages to survive an attempt on his life by someone who appears to be a cop. He attempts to get his job back, but Chief Baylor refuses, in light of discovering his heroin addiction. The coma has led to his decision to become a better man, and to right some wrongs. He reconciles with his wife, although awkwardly, and gives Walter a significant portion of insurance money that compensated his time in a coma. Finally, he visits the grave of fellow police officer Serge ([[William Ash , who once saved Stowe's life but has been killed by an unknown attacker following another failed sting operation. Valerie packs up to move out of the house so she can live with Mark, but after realizing the change that Stowe has undergone, she later decides to leave Mark and come home. Stowe is convinced by his friend Chad Mansen  not to let his wife go, and goes after her. They miss each other by a few minutes. Just after Valerie returns and meets Chad, some of Callahan's men show up. Jimmy kills Chad, and kidnaps Valerie. Stowe returns to the house, and finds Chad's body, along with Jimmy waiting for him. Jimmy takes Stowe to a warehouse where Callahan is waiting. Along the way, Stowe manages to overpower Jimmy and take his gun, but he finds that the odds against him are impossible- and Callahan has Valerie hostage. Van Huffel is revealed to be Callahan's mole on the police force, and the sting operation at the beginning of the film was a set-up. Walter suddenly arrives and saves Stowe. Together they kill all of Callahan's men, including Jimmy and Van Huffel, as Callahan tries to escape with Valerie to his helicopter. Just as they are about to reach it, Stowe grabs Callahan, and fires a shot that kills Callahan. Chief Baylor gives Stowe his job back. Three years later, Stowe and Valerie have a 3-year-old daughter, the baby that Valerie was pregnant with."
1788654;Novocaine;"Generally, the film is a dark and quirky ""tragicomedy"" concerning an ""everyman"" protagonist a fairly pleasant but rather innocuous, ordinary and uneventful life. But all of this gets derailed, and Frank's life descends into an increasingly complex mess, from the minute a beautiful and seductive new patient named Susan Ivey  comes to him, seeking a root canal and a little pain relief... On Susan's initial office visit, Frank schedules her for a root canal the very next day, and offers her some Ibuprofen to address her pain in the meanwhile. Claiming that she is allergic to the offered medication, Susan requests a prescription for the addictive pain-killer Demerol. Frank provides the prescription, but only for five tablets. However, Susan changes the dosage from five tablets to fifty when she collects the medication from her pharmacist. Susan arrives for her appointment twelve hours late, having mistaken the time. She seduces Frank, talking him into getting drunk and having sex with her. During the night, Susan steals all of Frank's narcotics. The next day, there is a DEA  agent at Frank's office demanding to see the dentist's narcotics supply, because an 18 year old has driven a car off a cliff under the influence of cocaine hydrochloride from a bottle registered to the dentist. Knowing that Susan has stolen his entire drug supply, Frank puts the agent off, saying he' dispensed it all to patients. The agent leaves with the promise that if Frank fails to produce the empty containers in two days, the DEA will place him under arrest. That night Frank goes to Susan's hotel room to demand the empty containers, threatening that he'll call the police if she doesn't provide them. Once again, she overrides his initial intentions and seduces him - with the result that they have sex and he spends the night with her. The next day at his office, Frank is confronted by Susan's brother, Duane Ivey  having a violent scene, saying: ""Stay the hell away from my sister"" and ""I don't appreciate your threats"". Duane ends the conversation with, ""I don't ever want to see you again, because if I do, goddamn it, I'm gonna hurt you."" That night, Frank returns to Susan's hotel room and, assuming that Susan is the form he sees the bed, starts talking to her. The person under the blanket turns out to be not Susan but brother Duane, who leaps up and attacks Frank, attempting to strangle him. Frank takes scissors from a nearby desk and stabs Duane in the hand, impaling him and embedding the scissors. Frank flees, stopping off at a bar to calm down. On arriving at home, just minutes ahead of Jean, he finds Duane dead on the floor. Police arrive on the scene to question Frank. Comically adding to Frank's distress and anxiety is actor Lance Phelps , a hack actor doing research for a role, and permitted by the police to question Frank at aggressive levels that cause Frank heightened discomfort. After the police arrive and depart, Frank tells Jean about the whole ordeal. A while later, Frank is arrested for the murder of Duane Ivey based on finding Frank's teeth marks on the body - that Jean put there after she herself killed Duane. After Frank breaks free, all of Chicago is on the look out for him. He goes to his office in the night, only to find his brother Harlan lying dead; Jean has killed Harlan, upon finding him lying on Frank's dentist chair. Realizing he'll never be free without starting over, Frank pulls out all of his dead brother's teeth, as well as all of his own. Frank uses his dental skills to place his own teeth into his dead brother's skull, and then sets fire to the dental office with Harlan's corpse, replete with replaced teeth, left inside. Frank and Susan, now lovers, escape to France, where they live happily ever after in a little cottage on the countryside. Meanwhile, identification of Frank's teeth in the charred corpse's remains in Frank's torched office is taken as proof that Frank is the man who was shot and killed there. And, as the fireproof security camera retrieved from the office ashes contains tape showing Jean shooting and killing a man  reclining in Frank's dental chair, Jean is convicted of Frank's murder and goes to prison."
25388139;Suryavamsam;Sakthivel Gounder  is one of the most respected, most educated and among the wealthiest men in his district. He is respected by one and all, however his only black mark is his son -Chinnarasu  who is considered a dunce owing to his poor academic history. Chinnarasu once loved and adored - Gowri who was his wife to be- until she attempted suicide to prevent this union . To prevent any misunderstandings- Chinnarasu declared that he was not interested in Gowri and earned his father's wrath. When Nandini  arrives for her brother's wedding to Chinnarasu's sister- she is moved by Chinnarasu's deep love and falls in love with him. Nandini and Chinnarasu marry and enrage both sets of their parents- however with Hard work Chinnarasu gradually becomes one of the biggest businessmen in town and among its wealthiest citizens- making Sakthivel proud of him. When the enemity of Ceheemban  threatens to create a rift, father and son solve it and the family is happily united. *nali V.Shanmugam-work by makeup man *Sarath Kumar- Chinnarasu/Sakthivel Gounder *Devayani- Nandini *Raadhika- Sakthivel Gounder's Wife *Manivannan- Chinnarasus Sidekick *Priya Raman- Gowri *Jai Ganesh *Ajay Ratnam
21735071;The Understudy;Rebecca is an unemployed actress who is living with an equally unsuccessful screenwriter, Sarfras. Rebecca makes a living by caring for a blind and diabetic woman while going through one disastrous relationship to the next. Rebecca is invited to understudy the famous movie star Simone Harwin , in the play Electra. Although Rebecca's unfulfillment is compounded: despite outshining the Action Star with her own talent, Rebecca is treated as second class, either bullied or ignored by the cast and crew including the director Ian, the stage manager Alison. Her salvation lies within the relationship with the seemingly perfect Firefighter Bobby. Accidents start to disrupt the leading ladies of Electra and Rebecca's star begins to rise, suspicion surrounds her. Can Rebecca hold onto the leading role and her freedom?
15912738;L: Change the World;"In the final 23 days of L's life, he meets one final case involving a bioterrorist group that aims to wipe out much of humanity with a virus. The virus has an infection rate that has one hundred times the infection rate of the Ebola virus. He takes a boy he names Near, the sole survivor of its use in a village in Thailand, and an elementary school student named Maki Nikaido under his wing. Dr. Nikaido later received a sample of the deadly virus which destroyed that village in Thailand. His assistant, Dr. Kimiko Kujo, reveals herself to be the leader of the organization that created the virus. Dr. Nikaido, who has created an antidote to that virus, refuses to give it her. He destroys the antidote and injects himself with the virus. She later kills him, and she is convinced that his daughter Maki has the antidote formula. Under the pursuit of Dr. Kimiko Kujo and her assistants, Maki runs and escapes. She eventually found L's headquarters. However, the group manages to track Maki down, forcing L, accompanied by Maki and Near, to run away with a high-tech crepe truck. They also received the help of FBI agent Hideaki Suruga during the escape. They escape to Nikaido's research partner's lab, because they needed his help to recreate the antidote. Using Near, L manages to acquire the antidote just as the terrorists are about to take an infected Maki to the US to spread the virus. L stops the plane and gives all the infected passengers, including the terrorist, the antidote. Maki then tries to kill Kujo for revenge, but L stops her, she goes to the hospital and wakes up with her stuffed bear next to her and a recording from L telling her to have a good day tomorrow. The film concludes with L leaving Near and giving him Near's ""real name""."
24589422;Maria’s Lovers;In the spring of 1946, Ivan, an American soldier, returns home psychologically scarred after spending some time in Japanese prison camp during World War II. Once back in his small Pennsylvania town, Ivan settles in, trying to put his life back together while living with his stoic peasant father. Shortly after his arrival, Ivan looks for his childhood sweetheart, Maria, a beautiful woman who is taking care of her old deaf grandmother. However, he is disappointed to find Maria in the arms of Al, a captain. Ivan's father thinks that Maria is too good for his son, but perhaps good enough for himself. He pairs his son with Mrs Wynic, a flirty neighbor. Ivan has sex with her, but he is tormented by the traumas of the war. He tells her that it was his dreams about Maria that allowed him to survive the prison camp. Ivan is given a hero's welcoming by his community, formed by immigrants from Yugoslavia. During the celebrations, when Al goes to dance with one of Maria's friends, Ivan grabs the opportunity to get close to her. Together they leave the party in his motorbike and head for their favorite spot of years ago. He gives her a pair of earrings that he planted there for her, before leaving for the war. The next morning Al is furious and breaks his relationship with Maria. Ivan's goal is fulfilled and he marries Maria in an orthodox ceremony, but his dream of a happiness share with Maria is soon broken. Having adored Maria for so long and from afar now that he has her close to him, Ivan is unable to consummate the marriage. Their happiness is shattered. Maria works as a nurse and would like to have children. Deeply in love with Ivan, she has to deal with her increasing sexual frustration. On the advice of Clarence, a drifter singer passing by the town, Ivan reaffirms his sense of manliness with Mrs Wynic. He is not impotent with her. Maria discovers this and a terrible argument occurs between them. The couple are invited by Al to his engagement party to Maria's girlfriend. In the middle of this gathering, Al breaks off the engagement realizing that he is still in love with Maria. Al and Ivan have a confrontation. Ivan offers him to take Maria, but to prove how much he loves her put his hand in a burning stove. Maria very much in love with Ivan tells Al that she does not love him. Maria heals Ivan's hand, but the unhappiness between them increases further. She is pursued by Clarence who tries to seduce her, but she remains faithful to Ivan and resist his advances. One day, unexpectedly, Ivan leaves town on a train without coming back. He moves to a new city, stars to work in a slaughter house and makes new friends. Left on her own devices Maria finally succumbs to Clarence's advances, but immediately after vehemently rejects him. As a result of this encounter she gets pregnant. Maria finds Ivan and tells him of her pregnancy and of the death of her grandmother, but Ivan is cruelly indifferent towards her. While going out with his friends one night, Ivan meets Clarence once again. Clarence does not remember him and tells the story of how he seduced Maria, but later she refused to have anything else to do with him. Furious, Ivan hits Clarence who still does not know what is going on. Still tormented by nightmares of his war experiences, Ivan is visited by his father. He tells him that he is dying and that he must come back to Maria. Ivan returns home, he tells Maria that he loves the baby. Now that the pure image of Maria has been broken, they are able to happily make love for the first time.
4767342;Sa Pusod ng Dagat;In a remote fishing island in the 50's, Pepito  grows up learning the trade of his mother, Rosa , the only midwife capable of delivering the newborn babies of their community. At first, the young son doesn't mind the unusual arrangement, but as he grows older, he begins to resist the role traditionally meant only for women. In time, Pepito's coming of age intersects with the lives of other islanders whose beliefs and struggles become critical impetus to his maturity. Eventually, embarrassment and prejudices were overcame by acceptance and love between mother and son
28177482;My Brother's Keeper;Handcuffed together, George Martin ([[Jack Warner  and Willie Stannard ([[George Cole  are two newly-convicted criminals being transported to prison. Martin is a hardened, cynical career criminal, while Stannard is a naïve, rather dull-witted youth who has never previously been in trouble with the law, maintains his innocence of the rape for which he has been convicted and is terrified by the prospect of prison. During the journey the pair manage to escape. Martin steals an army officer's uniform and passes Stannard off as a deserter in his charge, being returned to face a military tribunal. The escape location has been chosen by Martin for its proximity to a garage run by his mistress Nora Lawrence , who provides the pair with overnight shelter. The following day Martin and Stannard take refuge in a derelict isolated cottage. While trying to file their handcuffs apart they are surprised by a hunting man with a gun. A struggle ensues, during which Martin shoots and kills the man. Shortly thereafter they manage to separate the handcuffs and Martin abandons Stannard, going on the run alone while Stannard gives himself up and is promptly charged with murder. Martin manages to contact his wife in London, asking if she can find a way to get money to him. She arranges to travel by taxi to the woods in which he is hiding. Just as she arrives, the police have tracked Martin down and have him cornered. Rather than give himself up, Martin makes a final doomed attempt to escape through a signed minefield, watched by police, reporters, his wife and mistress and a crowd of sensation-seeking gawkers.
3662683;American Dreamz;"On the morning after his re-election, US President Joseph Staton the morning after decides to read the newspaper for the first time in four years. This starts him down a slippery slope. He begins reading obsessively, reexamining his ""black-and-white"" view of the world in a more ""gray-seeming"" way, and holing up in his bedroom in his pajamas. Frightened by the President's apparent nervous breakdown, his Chief of Staff  pushes him back into the spotlight, booking him as a guest judge on the television ratings juggernaut , the weekly talent show American Dreamz, a show similar in format to the modern-day American Idol. America cannot seem to get enough of American Dreamz, hosted by self-aggrandizing, self-loathing Martin Tweed , ever on the lookout for the next insta-celebrity. His latest crop of hopefuls includes Sally Kendoo , a conniving steel magnolia with a devoted, dopey veteran boyfriend William Williams ([[Chris Klein , and Omer Obeidi . Because Omer's mother died in the Middle East in an American attack, he joined a group of jihadists. He was an actor in an instruction film for terrorists, but he was too clumsy, and his interest in Western music was frowned upon. Therefore he was sent to the U.S. to await further instructions, but the leaders expected they could not use him. He moved to Southern California to live with his extended family there, including his effeminate cousin Iqbal  and Shazzy . Iqbal hoped to be selected to participate in American Dreamz, but in a misunderstanding Omer was selected instead. Iqbal becomes his manager. Omer's terrorist organization now sees an opportunity: Omer is instructed to make it to the finale, and kill the President in a suicide attack. He succeeds in getting to the finale. Security is bypassed by assembling the bomb after the security check, in the toilet, from small parts smuggled in. Small pieces of explosive are disguised as chewing gum. Omer agrees, but changes his mind and disposes of the bomb in the trash can. Sally is the other finalist. Earlier she dumped William. He went into the army, was wounded in Iraq, and came back to the U.S. For the purpose of the show, Sally pretends she still loves William. However, he sees Sally having sex with Martin, and is furious. After he finds the bomb in the trash can, he comes on stage and threatens to detonate it. While the other people evacuate, William starts singing and Martin, who refuses to let go of the camera, films it. As William reaches the end of the song, he detonates the bomb by walking into the camera, killing both himself and Martin. The film then cuts to shots of people dialing up their cell phones to vote in for the winner. It is eventually revealed that William Williams is the surprise winner of American Dreamz. The end of the film reveals what each of the characters went on to do after the end of last season. Omer went on to become a successful star of his own Broadway revue. At the end of the film he appears in a scene from the musical Grease. The President makes his wife his new Chief of Staff. And Sally Kendoo becomes the new host of American Dreamz."
35068740;Chinnavar;Muthu ([[Prabhu  and Veerasamy  are fishermen and they fish together in the same boat. Muthu lives with his mother . Veerasamy drinks lot of alcohol and he has a sister, Meena ([[Kasthuri  who is in love with Muthu. Muthu decides to marry his carefree friend Veerasamy to Ponni ([[Chithra . In a financial trouble, Veerasamy joins Kumar's boat, Kumar  is a rich fishermen union leader. Veerasamy realizes that Meena is in love with Muthu and he promises to Muthu his sister's hand. Meanwhile, Kumar asks Veerasamy to marry Meena, compelled by his wife, Veerasamy accepts. Hopeless, Meena ties to herself a Thaali, she says to Veerasamy that Muthu marries her and Muthu confirms to save her honor. Veerasamy gets angry but when Muthu says the truth, he apologizes to him. Kumar beats Muthu's mother and kidnaps Meena, he arranges a forced marriage between him and Meena. Muthu saves her and he marry her with his best friend blessing.
9709159;The Policeman;"Officer Avraham Azoulay is a patrolman in Tel-Aviv's district of Jaffa. He is an honest man, though extremely naive, and because of his character, has never been promoted during his twenty years in the force. He is married to a dull woman ; the couple have no children. His superiors, Captain Levkovich and First Sergeant Bejerano, decide not to renew his contract, though they feel sorry for him. In the meantime, he falls in love with the simple but charming prostitute Mimi, and removes her photograph from the arrests billboard. His wife finds the photo and tears it to pieces, which Azoulay secretly glues together again. Nevertheless, this love will not be realized as Azoulay refuses to divorce his wife, claiming that ""it will destroy her"". In addition, being a Kohen, he cannot marry a prostitute according to Halakha. Azoulay shows some success at dispersing a demonstration without resorting to violence because of his knowledge in the bible and in Yiddish; he also charms a group of visiting French policemen who adore the French-speaking policeman; in an Arab speaking club house he gives an unaware speech in Arabic. Azoulay is able to see people for what they are and not what they represent. None of these events, however, help to change his superiors' decision to dismiss him. Azoulay forms a friendship with Amar, unaware that he is a notorious criminal. The criminal and his associates decide to fake a crime and allow Azoulay to catch them in the act so that he receive a promotion and regain his contract. They finally decide upon stealing ritual objects, including a large golden cross, from a monastery in the neighborhood. Azoulay manages to catch the criminal in the act and is finally promoted to the rank of a sergeant, but his contract is not renewed and he is forced to retire from the police. In the final scene officer Azoulay leaves the precinct with his new rank and policemen practicing marches in the courtyard all turn to salute him for the first and last time in his life. The final shot of the film presents Azoulay saluting the marching policemen as his eyes fill with tears. This image became one of the most memorable in Israeli cinema."
25094002;Rose by Any Other Name...;The story follows the main characters Rose a comfortably out woman who identifies as lesbian and Anthony a decent progressive straight man who serendipitously meet and then unexpectedly find themselves falling for each other. Rose has to navigate the reaction of her friends  and her family  while Anthony too has to deal with his friends who are equally nonplussed.
30673459;Witness Insecurity;The story centers around Johnny Graham  who was raised by the Torino crime family after his parents' death. He is constantly bothered by the fact that he has to make a decision of whether he should stay loyal to the family that adopted him or his conscience. It is apparent to Johnny that it is time to act when Anthony Torino  sets his sights on D.A. Elizabeth Jones ([[Grace Johnston  who is prosecuting him for the gruesome murder of his cousin. Though Johnny is the family accountant, he is an excellent marksman and he volunteers to make the hit. He persuades a hesitant Anthony into letting him eliminate the DA when in actuality he only want to warn her. His plan is ruined by two men from the Torino family sent to oversee his first hit. The shootout that followed leaves Elizabeth wounded, one of the two men dead, and Johnny arrested. His conscience takes control of him when he confesses and is entered into the Federal Witness Security Program. Shortly after, Anthony is apprehended but escapes and makes contact with a mole in an attempt to uncover the locations of Johnny and the others who were going to testify against him in trial. Torino family hit-man and Johnny's longtime friend, Vince, comes to the farm where Johnny was hidden. Once again, Johnny is scrambling to keep the lives of those who have paths with Anthony intact, including his own. On his journey, he realizes he is not alone on his mission.{{cite web}}
