24073089;Folks!;"Folks! tells the story of Jon Aldrich , a successful stockbroker who is living the good life with a wife and kids until his aging father with dementia accidentally burns down his own house. Jon tries to get his sister, Arlene Aldrich  who has two sons of her own but is an irresponsible gold digger, but she won't even open the door. As a result his father Harry Aldrich/Pop  and his mother Mildred Alrdich  have to move in with him and his family. That is the moment that his good life starts going down hill. The company he works for was apparently doing illegal things which Jon knew nothing of, but no one believes him therefore he loses his job. The problems for Jon continue to mount up as the family becomes broke, his wife Audrey  thinks moves out with the kids, and they lose all their furniture and belongs except their apartment. Harry continues to unintentionally injure Jon, causing him hearing lost, a broken hand, a car runs over his foot, and he manages to lose a testicle. Jon slowly starts to lose his own sanity, but in a brief moment of his own sanity Harry tells Jon that he never wanted to be a burden on him but he soon slips back into his state of dementia, where he is just happy all the time and often yells out ""McDonalds"". Jon talks with his mother who also says that she and his father never wanted to be a burden on him. She then tells him that she and his father have discussed it, and they want Jon to help them die so he can collect the insurance money. Jon is totally against this at first but after a while he changes his tune. Jon helps his parents try to commit suicide many unsuccessful times and half way through the attempts Jon's sister Arlene shows up on his doorsteps with both of her corpulent sons in need of a place to live. Jon refuses at first due to the fact that she would not even open the door for them but he eventually caves in and lets them stay. Arlene also joins in on the attempts to help their parents die, hoping for a cut of the insurance money. Though her attempts are also unsuccessful. Things slowly start looking up for Jon as Audrey eventually shows up home to tell John she was wrong for leaving and how much she loves the fact that he was willing to take in both of his parents. Upon her arrival she realizes all all the injuries Jon has suffered since she saw him last, including the missing testicle. As they are reconciling Jon realizes that Arlene and his parents are gone and he knows they are going to try to commit suicide again with the help of his sister, so he tracks them down in an attempt to stop them which he successfully does, but not without facing a bit more injury. Alrdich eventually get their lives on track. Jon and Audrey buy a house and Jon's parents live with them. Arlene is now with a man who knows how to handle her bad behaving children. At the end we finally find out that Harry hasn't been yelling McDonalds because he was hungry, he was yelling it because he bought stock in McDonnell Douglas years and years ago, meaning he is worth tons of money."
30405742;Plug & Pray;Computer experts around the world strive towards the development of intelligent robots. Pioneers like Raymond Kurzweil and Hiroshi Ishiguro dream of fashioning intelligent machines that will equal their human creators. In this potential reality, man and machine merge as a single unity. Rejecting evolution's biological shackles tantalisingly dangles the promise of eternal life for those bold enough to seize it. But others, like Joseph Weizenbaum, counter attack against society's limitless faith in the redemptive powers of technology. Eloquent and tactful, he questions the prevailing discourses on new technologies, and their ethical relationships to human life. The film delves into a world where computer technology, robotics, biology, neuroscience, and developmental psychology merge and features the world’s leading roboticists in their laboratories in Japan, the USA, Italy and Germany.
23991052;Northern Lights;"Homicide detective Nate Burns  once lived a tough life in Baltimore, but decides to move to a small Alaskan town, after being offered the position of chief of police. Burns leaves Baltimore just a few weeks after his partner is shot and killed, feeling partially responsible for what has happened. Nate finds himself not very welcome by the town's residents, but takes an immediate interest in Meg Galligan . Meg is a young pilot, whose father left and disappeared in 1994; leaving her mother Charlene , who Meg constantly argues with, to single-handedly take care of her. Soon, Nate helps in the search and rescue of two lost mountain climbers, and asks for Meg's help in getting there. Upon their rescue, Nate also locates a frozen corpse, who turns out to be Meg's father. It's clear that he was murdered, as the axe used to kill him is still embedded in his body. Meg has trouble mourning for her father, because she has always been mad at him for abandoning his family. Meg suggests that Nate begin to investigate, but he is reluctant to do so, explaining that he moved from Baltimore to avoid murder cases. After giving in, Nate starts collecting information, and soon finds that nobody in town liked the man, and that he had affairs with several of the townswomen. Soon, Max, one of the locals, seemingly commits suicide. Nate believes that Max had something to do with Meg's father's death. This upsets Meg, as Max was a well-liked man in town. Eventually they find Max's journal, in which he admits to the murder. Nate however, doesn't believe he was the sole murderer, and refuses to believe that he committed suicide. With the help of Meg, Nate continues the investigation. As they take their relationship to a new level, he finds out that they are being followed. Fearing for their own lives, Nate starts questioning everyone in town. Nate proposes to Meg, and soon after getting engaged, Nate is fired, because the locals have been complaining that all the trouble started after he arrived. Nate briefly considers returning to Baltimore, until he learns that an earring was found next to the body. As the police arrive to arrest the murderer, he takes a woman hostage and shoots Meg in the arm. He is arrested after Nate shoots him. In the final credits, the location of filming is stated to be Alberta, but in fact it was filmed in Dawson City in Yukon Territory, the town where the Yukon and Klondike Rivers meet."
6084851;Le gendarme se marie;The gendarme Cruchot meets Josepha, a widow. He quickly falls in love with her. But Cruchot's daughter isn't really happy with that, and will do anything to prevent the wedding.
2322506;Fantastic Planet;"The film depicts a future in which human beings, known as ""Oms"" , are creatures on the Draags' home planet, where they are seen as pests and sometimes kept as pets . The Draags are an alien species which is humanoid in shape but a hundred times larger than humans, with blue skin, fan-like earlobes and huge, protruding red eyes. The Draags also live much longer than human beings – one Draag week equals a human year. Some Oms are domesticated as pets, but others run wild, and are periodically exterminated. The Draags' treatment of the Oms is ironically contrasted with their high level of technological and spiritual development. The story opens with a woman running, occasionally looking behind her as if pursued. An enormous hand descends and blocks her way. She runs back the way she came and finds her way blocked by another hand. It becomes apparent that she is being toyed with by entities that do not appreciate her fragility, and as she dies, the infant she has been carrying and attempting to protect begins to cry. The view changes to reveal the Draag children who have accidentally killed the woman; they leave quickly when an adult Draag and child approach. The child voices concern for the orphaned infant, and the two take the child to their home. Tiva  names the infant Terr . Her father, whom the adult Terr voice-over explains is master Sinh, the Draag great Aedile, attaches a collar capable of physically dragging Terr back from mischief, and over the next several scenes, their relationships develop. Terr witnesses the parents seemingly ingesting food by inhaling it from a device. After changing Terr's costume as one would a doll's, Tiva uses makeup to give herself a more Om-like appearance. When Terr impishly trades dark pigment for light, Tiva blows some of the powder on him. Tiva uses a tiny indoor weather-maker to cause a small storm cloud to form over Terr and chase him around the dwelling. Tiva takes Terr for a walk, and then teaches him how, under certain circumstances, crystals will form on stationary objects, including standing bipeds. She also teaches him that whistling will shatter the crystals. Terr happens upon master Sinh as he and several compatriots are melding in a ritual, and it is revealed that many Draag children have Oms like Terr when they convene to watch their respective Oms interact. Tiva's education is supplied by the use of a headset that transmits knowledge directly into the brain of the user. Because she enjoys having Terr in her hand when she is having her ""infos,"" Terr begins to acquire their knowledge. Meanwhile, at the seat of government, Draag Councilors discuss whether the regular extermination of the wild Oms is sufficient to keep their numbers at an acceptable level. It is revealed that Oms were first found on a planet that retained some evidence of structured life, but the images seem to reveal that Earth was in a post-apocalyptic state at the time. Terr decides to escape, and to take the headset with him. He does not get very far before Tiva realizes he is missing, and her mother tells her to use her bracelet to bring him back. Terr finds himself suddenly being dragged backward by the collar. Only the headset becoming entangled in plants allows a wild female Om to come to his rescue before he is choked by the collar or dragged all the way back. When Terr explains that the headset contains the knowledge of the Draags but he doesn't know where to go with it, his unnamed rescuer takes him to her tribe, who live in a tree in a walled park. When it is demonstrated that Terr can read Draag script, the leader  is willing to accept Terr into the tribe, but the Wizard is not, and demands a trial by combat – to the death. Terr and the Wizard's champion have child-sized animals bound to their torsos in such a way as to prevent the combatants from using anything but the beaks of said animals to attack. Terr is injured, but wins the trial. Over the next several scenes, it is shown how the Oms have adapted to life on the Draags' planet. Snail-like animals weave clothes onto the Oms, predators that would eat Oms are in turn hunted and efficiently stripped of useful materials, and the gene pool is kept well-mixed. Oms even make the occasional foray into Draag areas in search of resources. Returning from one such expedition, the group of adventurers is accosted by bandits who drop clawlike harpoons into the cargo and simply lift it up into their own tree. Mighty One tells Terr that they live on the other side of the park, and cautions him that they are evil. When the now-literate Oms read the new sign on one of the walls, they realize the park is about to be ""de-Omised."" Terr decides that he must take this information to the tribe of bandits, and is quickly captured and taken before their leader, a wizened old woman. The woman is skeptical of his claims and orders Terr's imprisonment. When the de-Omising begins, however, the old woman returns and frees him. The de-Omising is accomplished using disks that release a poison gas. A great many Oms perish from this gas, but a sizable number still manage to escape through a crack in the park wall. Two passing Draags witness the exodus, and one begins crushing the Oms underfoot. The Oms retaliate and manage to kill their attacker while the other escapes. Afterward, Mighty one is revealed to be killed and the old woman leads the survivors to a place where she believes they will be safe. The death of a Draag puts the Council in an uproar. De-Omising is stepped up to a much higher priority, new technologies are developed, and extermination frequency is scheduled to greatly increase. The old woman has led the two now-united tribes to an old rocket depot. Applying their newfound knowledge, the Oms, under Terr's direction, very quickly adapt the abandoned technologies to their own purposes and begin to flourish, thanks to the rebirth of mechanized industry. On a visit to the old woman, Terr's wife hears her express both optimism and regret that she will not live to see the Oms finally find peace. Fatalities resulting from Draag attempts to de-Om the rocket depot are minimized by the creation and organized use of shelters, but the Draags' updated de-Omising technologies become ever more aggressive, and when an automated scout detects the persistent Om settlement, it summons an array of lethal devices. As the attacks become more diverse and effective, the Oms launch their manned rockets toward the Fantastic Planet, where they discover headless humanoid statues. As Draag meditation bubbles descend to alight atop the statues, the statues begin to dance. It is revealed via Terr's voiceover that this is the secret of the Fantastic Planet. Draag meditation animates the statues and allows the Draag to reproduce. When the feet of the dancing statues threaten the rockets, the Oms use energy weapons to shatter the statues, effectively killing thousands of meditative Draag. Pandemonium reigns in the Council chamber, for it seems the two species will destroy one another if they cannot find a way to live together. Apparently they do just that, for in the very next scene, an Om steps down off an outstretched Draag hand, removes his silly hat and assumes a posture of confidence and self-assertion. The headset voice dispassionately recounts the Om's construction of a new satellite where Oms can live, ""which they call Terr, after their ancestral planet."""
13495023;The Secret Man;Cheyenne Harry escapes from jail and lies low, working as a hired ranch hand. When he discovers a missing child in the wilderness, however, a complex plot of honor and secrecy unfolds.
1813912;Tell Them Willie Boy Is Here;"The film's story revolves around the Paiute Indian outlaw Willie Boy ([[Robert Blake  who escapes with his lover, Lola  after killing her father in self defense. According to tribal custom Willie can then claim Lola as his wife. According to the law, Deputy Sheriff Cooper  is required to charge him with murder. Willie Boy and Lola are hunted for several days by a posse led by Cooper. Willie manages to repel the posse’s advance when he ambushes them from the top of Ruby Mountain. He only tries to shoot their horses, but ends up accidentally killing a bounty hunter, resulting in another murder charge. Days later, as the posse closes in, Lola dies by a gunshot wound to the chest. It is left deliberately ambiguous whether Lola shot herself in order to slow down the posse's advance or whether Willie killed her to keep her out of the posse's hands. Cooper is inclined to believe the latter and then goes off ahead of the posse to bring in Willie dead or alive. As soon as Cooper catches up, he comes under fire from Willie who is positioned at the top of Ruby Mountain. Cooper narrowly avoids being shot on several occasions. In the film's climax, Cooper maneuvers behind Willie, who has donned a ghost shirt, and tells him he can turn around if he wants to, which he does. The two pause before Willie raises his rifle at Cooper, who beats him to the draw and shoots him. Fatally struck in the chest, Willie tumbles down the hillside. Cooper picks up Willie’s gun and finds that it wasn't even loaded, making it apparent that Willie deliberately chose death over capture. Abashed, Cooper carries the slain outlaw the rest of the way down Ruby Mountain and delivers him to other Paiutes, who carry the corpse away and burn the remains. When confronted by the county sheriff, Cooper is told that the burning of Willie's body will ruin the people's chance to see Willie in the  flesh, denying them the ability ""to see something"". Cooper retorts: ""Tell them we're all out of souvenirs."""
23605990;Beck – Pensionat Pärlan;"--&#62;  *Peter Haber as Martin Beck *Mikael Persbrandt as Gunvald Larsson *Stina Rautelin as Lena Klingström *Per Morberg as Joakim Wersén *Rebecka Hemse as Inger  *Michael Nyqvist as John Banck *Anna Ulrica Ericsson as Yvonne Jäder *Peter Hüttner as Oljelund *Lennart Hjulström as Gavling *Lasse Lindroth as Peter"
32558509;Blind;"A missing person case involving a female university student and the victim in a hit and run case appears to be related. Detectives look for a witness. Into the police office walks Min Soo-Ah . She used to be a promising cadet at the police academy, but after a horrific car accident which killed her surrogate brother, Soo-Ah's police career ended. Min Soo-Ah also lost her eyesight in the car accident. Min Soo-Ah reveals to Detective Jo  at the police station that on the night of the hit and run case she was picked up by a taxi cab driver. Soo-Ah believes the taxi driver may be the perpetrator of the crimes. Initially, Detective Jo doesn't take Soo-Ah's claims seriously because she is blind, but when Soo-Ah displays her acute senses the detective starts to believe her. Detective Jo and Min Soo-Ah then work together to find the taxi cab driver, but all their leads turn up empty. Then another witness comes forward Kwon Ki-Sub . Kwon Ki-Sub is a motorcycle delivery boy who claims to have also witness the hit and run incident. Kwon Ki-Sub also emphatically states that the car in question was not a taxi cab, but rather an imported sedan. Meanwhile, Min Soo-Ah finds herself being stalked by a mysterious man. [Spoiler] It turns out that the gynecologist, Myung Jin  is the mysterious man stalking her as well as the killer. Min Soo-ah, while in the car with him, remembered that he had a strong scent/cologne, he had a watch on his right hand, and he gave her an iced coffee drink in a glass can. While in the car with him, they hit a bump while in an argument. The body of the dead university student rolls out of the trunk and Myung Jin gets out to examine it. When Min Soo-Ah goes out as well to inspect the damage done, he claims that he hit a dog, but she reasons with him, starting another fight. He leaves her in the rain when another car comes. The reason why she was in the car with him is because she needed a ride back from visiting the orphanage she used to grow up in. She had gotten angry and stormed out because her ex-guardian tried to give her two things-- tickets to her dead brother's dance group's upcoming dance showdown, and a device that vibrates when a person or moving object-- or any object-- came too close. It would help her with her disability, but Min Soo-ah strongly disapproved of it. One night when Ki-Sub is walking home alone, he is followed by Myung Jin. Ki-Sub at first runs away, but is snuck up on and hit by a brick. An ambulance comes and the Detective/Min Soo-ah drives to the scene. When the Detective finishes up his interviews with the people and follows the ambulance to the hospital, we realize that Myung Jin was in the background, watching Min Soo-Ah in the car. At the hospital, the doctor tells them that because Ki-Sub has such a thick skull, only a small fracture was shown in the X-Ray scan. They are relieved and visits him. Ki-Sub gets annoyed by Min Soo-ah's constant nagging, and on the day of his release, storms out in anger. When he reaches the nearly-empty subway station, he sees Min Soo-ah on the other side and then sees her ride the subway, as well as the killer. He calls her on her phone and tells her urgently that the killer is in front of her. As he runs to catch up with her, she goes on Facetime and shows him her location and surroundings. He guides her out of the subway and to safety, as well as her seeing-dog, Seul-Gi . However, at one point, she trips, but gets up and feels the ground and way out . However, at one point, the killer catches up with her and leads her away, with a knife to her body. She reaches into her handbag and sprays his eyes with her pepper spray and runs off with Seul-Gi. When she reaches the elevator, she thought that she'd be safe, but the killer quickly gets in. Ki-Sub, who still sees her surroundings by Facetime, gets scared when he sees blood splatter on the elevator's button and the fact that Min Soo-Ah fainted. However, what they didn't know at the time was that Seul-Gi shielded Min Soo-Ah from the knife and while she was getting stabbed, grabbed the killer by the jacket and led him out of the elevator. In that scene, Seul-Gi dies by being stabbed many times while watching her owner go up through the elevator. When Min Soo-Ah wakes up, she asks for her seeing dog, but the doctor handed her the blood-stained leash. At home, Min Soo-Ah listens to many video tapes of her past self, when she had just graduated from the police academy. She laid down and listened to her brother's voice, as well as the voice of the orphanage lady. Halfway through, she gets a call from an unknown number. There is a raspy voice. The caller warns her from this case. ""You can't see me, but I'm watching you."" A few days later, the Detective had narrowed down the number of licensed imported black Sedans and finally, in a garage, he finds the killer. They get into a violent fight, in which the detective dies and the killer drives off. Meanwhile, Ki-Sub and Min Soo-Ah visits the orphanage again when they're asked to watch over it while the grandmother takes the children out. Ki-Sub finds the dead brother's room and various pictures. Min Soo-Ah goes to the 'office' and finds a cabinet filled with her past memories as a cop, as well as the vibrating motion sensor. The killer enters into the living room and lights a cigarette and listens to some music. Min Soo-Ah, annoyed by the music, goes downstairs to turn it off. She reprimands Ki-Sub for playing it, but smells the cigarette. Ki-Sub goes upstairs and fights with Myung Jin while Min Soo-Ah runs away. After a few minutes of them playing Cat and Mouse, she lights him on fire and takes the vibrating motion sensor. She helps Ki-Sub outside, where it's raining. Ki-Sub fights the killer again and Min Soo-Ah goes to the car and breaks it with the motion sensor. The killer runs at her with a knife and with the right timing and the motion sensor, she hits him on the head, making him fall unconsious. The police, who had picked up the Detective's body, had found the evidence and eventually found out who the killer was. The killer was put in jail and Min Soo-Ah was re-admitted to the academy and graduated again. Ki-Sub also enrolled into the police academy. It ends with another video, similar to the video of her first graduation, except instead of her surrogate brother, it had Ki-Sub. While the credits roll, you see pictures of them respectfully visiting the Detective's funeral."
